{"$schema":"https://json-schema.org/draft/2020-12/schema","$id":"https://example.invalid/gd-evaluation/schemas/rater-sheet-v0.1.schema.json","title":"Human Rater Sheet v0.1","type":"object","additionalProperties":false,"required":["contract_version","sheet_id","episode_id","scenario_id","annotator_id","rubric_version","calibration_set_version","started_at","completed_at","evaluation_stage","workflow_attestations","dimensions","overall_notes"],"$defs":{"dimensionEntry":{"type":"object","additionalProperties":false,"required":["dimension","opportunity_status","opportunity_evidence_event_ids","selected_evidence_message_ids","score","confidence","comment","not_evaluable_reason","flags"],"properties":{"dimension":{"enum":["issue_framing","logical_reasoning","listening_and_response","valuable_contribution","collaboration_and_relationship","decision_and_consensus","process_and_time_management"]},"opportunity_status":{"enum":["sufficient","insufficient","uncertain"]},"opportunity_evidence_event_ids":{"type":"array","uniqueItems":true,"items":{"type":"string","minLength":1}},"selected_evidence_message_ids":{"type":"array","uniqueItems":true,"items":{"type":"string","minLength":1}},"score":{"oneOf":[{"type":"integer","minimum":1,"maximum":4},{"const":"NE"}]},"confidence":{"type":"number","minimum":0,"maximum":1},"comment":{"type":"string","minLength":1},"not_evaluable_reason":{"oneOf":[{"type":"null"},{"enum":["INSUFFICIENT_OPPORTUNITY","AI_QUALITY_FAILURE","TRANSCRIPT_INCOMPLETE","INSUFFICIENT_EVIDENCE","JUDGE_FAILURE","SCENARIO_CONTRACT_FAILURE","OTHER_REVIEW_REQUIRED"]}]},"flags":{"type":"array","uniqueItems":true,"items":{"enum":["POTENTIAL_BIAS","TRANSCRIPT_ISSUE","OPPORTUNITY_ISSUE","RUBRIC_AMBIGUITY","EVIDENCE_AMBIGUITY","REVIEW_REQUIRED"]}}},"allOf":[{"if":{"properties":{"score":{"const":"NE"}},"required":["score"]},"then":{"properties":{"not_evaluable_reason":{"enum":["INSUFFICIENT_OPPORTUNITY","AI_QUALITY_FAILURE","TRANSCRIPT_INCOMPLETE","INSUFFICIENT_EVIDENCE","JUDGE_FAILURE","SCENARIO_CONTRACT_FAILURE","OTHER_REVIEW_REQUIRED"]},"selected_evidence_message_ids":{"maxItems":0}}}},{"if":{"properties":{"score":{"type":"integer"}},"required":["score"]},"then":{"properties":{"not_evaluable_reason":{"type":"null"},"selected_evidence_message_ids":{"minItems":1},"opportunity_status":{"const":"sufficient"}}}},{"if":{"properties":{"score":{"const":4}},"required":["score"]},"then":{"properties":{"selected_evidence_message_ids":{"minItems":2}}}},{"if":{"properties":{"opportunity_status":{"const":"insufficient"}},"required":["opportunity_status"]},"then":{"properties":{"score":{"const":"NE"},"not_evaluable_reason":{"enum":["INSUFFICIENT_OPPORTUNITY","AI_QUALITY_FAILURE","TRANSCRIPT_INCOMPLETE","SCENARIO_CONTRACT_FAILURE","OTHER_REVIEW_REQUIRED"]}}}}]}},"properties":{"contract_version":{"const":"0.1"},"sheet_id":{"type":"string","minLength":1},"episode_id":{"type":"string","minLength":1},"scenario_id":{"type":"string","minLength":1},"annotator_id":{"type":"string","minLength":1},"rubric_version":{"const":"candidate-behavior-v0.1"},"calibration_set_version":{"type":"string","minLength":1},"started_at":{"type":"string","format":"date-time"},"completed_at":{"type":"string","format":"date-time"},"evaluation_stage":{"enum":["independent","adjudication_recheck","training"]},"workflow_attestations":{"type":"object","additionalProperties":false,"required":["ai_scores_hidden","evidence_selected_before_score","rubric_consulted","identity_blinded"],"properties":{"ai_scores_hidden":{"const":true},"evidence_selected_before_score":{"const":true},"rubric_consulted":{"const":true},"identity_blinded":{"const":true}}},"dimensions":{"type":"array","minItems":7,"maxItems":7,"items":{"$ref":"#/$defs/dimensionEntry"},"allOf":[{"contains":{"properties":{"dimension":{"const":"issue_framing"}},"required":["dimension"]},"minContains":1,"maxContains":1},{"contains":{"properties":{"dimension":{"const":"logical_reasoning"}},"required":["dimension"]},"minContains":1,"maxContains":1},{"contains":{"properties":{"dimension":{"const":"listening_and_response"}},"required":["dimension"]},"minContains":1,"maxContains":1},{"contains":{"properties":{"dimension":{"const":"valuable_contribution"}},"required":["dimension"]},"minContains":1,"maxContains":1},{"contains":{"properties":{"dimension":{"const":"collaboration_and_relationship"}},"required":["dimension"]},"minContains":1,"maxContains":1},{"contains":{"properties":{"dimension":{"const":"decision_and_consensus"}},"required":["dimension"]},"minContains":1,"maxContains":1},{"contains":{"properties":{"dimension":{"const":"process_and_time_management"}},"required":["dimension"]},"minContains":1,"maxContains":1}]},"overall_notes":{"type":"string"}}}
