{"contract_version":"0.1","sheet_id":"rater-b-exercise-a-medium-001","episode_id":"exercise-a-medium-001","scenario_id":"candidate-assessment-a-ambiguous-structure","annotator_id":"rater_b_anon","rubric_version":"candidate-behavior-v0.1","calibration_set_version":"exercise-a-medium-v0.1","started_at":"2026-08-04T11:30:00Z","completed_at":"2026-08-04T11:45:00Z","evaluation_stage":"independent","workflow_attestations":{"ai_scores_hidden":true,"evidence_selected_before_score":true,"rubric_consulted":true,"identity_blinded":true},"dimensions":[{"dimension":"issue_framing","opportunity_status":"sufficient","opportunity_evidence_event_ids":["ev_opp_01","ev_opp_02","ev_opp_03"],"selected_evidence_message_ids":["m004","m006","m007"],"score":2,"confidence":0.65,"comment":"対象と基準は示したが、目的と制約の優先順位付けは十分でない。","not_evaluable_reason":null,"flags":["RUBRIC_AMBIGUITY"]},{"dimension":"logical_reasoning","opportunity_status":"sufficient","opportunity_evidence_event_ids":["ev_opp_04","ev_opp_05"],"selected_evidence_message_ids":["m014","m016"],"score":2,"confidence":0.8,"comment":"比較理由は示したが、数値や根拠の検証は限定的だった。","not_evaluable_reason":null,"flags":[]},{"dimension":"listening_and_response","opportunity_status":"sufficient","opportunity_evidence_event_ids":["ev_opp_06","ev_opp_07"],"selected_evidence_message_ids":["m011","m016"],"score":3,"confidence":0.8,"comment":"騒音と動線の懸念へ直接応答し、案を修正した。","not_evaluable_reason":null,"flags":[]},{"dimension":"valuable_contribution","opportunity_status":"sufficient","opportunity_evidence_event_ids":["ev_opp_08","ev_opp_09"],"selected_evidence_message_ids":["m009","m016"],"score":3,"confidence":0.71,"comment":"時間帯分離と可動机を組み合わせ、議論を具体的に前進させた。","not_evaluable_reason":null,"flags":["RUBRIC_AMBIGUITY"]},{"dimension":"collaboration_and_relationship","opportunity_status":"sufficient","opportunity_evidence_event_ids":["ev_opp_10"],"selected_evidence_message_ids":["m011"],"score":2,"confidence":0.68,"comment":"懸念へ応答したが、他参加者の発言機会を積極的に作る行動は限定的だった。","not_evaluable_reason":null,"flags":[]},{"dimension":"decision_and_consensus","opportunity_status":"sufficient","opportunity_evidence_event_ids":["ev_opp_11"],"selected_evidence_message_ids":["m017","m020"],"score":3,"confidence":0.8,"comment":"基準と実証条件を含む結論を提示し、合意を確認した。","not_evaluable_reason":null,"flags":[]},{"dimension":"process_and_time_management","opportunity_status":"sufficient","opportunity_evidence_event_ids":["ev_opp_12"],"selected_evidence_message_ids":["m021"],"score":2,"confidence":0.8,"comment":"最後に要約と見直し時点を示したが、途中の進捗調整は少ない。","not_evaluable_reason":null,"flags":[]}],"overall_notes":"medium境界ケースとして独立採点した。"}
