{"annotator_id":"rater_a_anon","calibration_set_version":"exercise-c-high-low-v0.1","completed_at":"2026-08-05T12:35:00Z","contract_version":"0.1","dimensions":[{"comment":"比較軸を具体化せず、無難さだけで方向を決めた。","confidence":0.86,"dimension":"issue_framing","flags":[],"not_evaluable_reason":null,"opportunity_evidence_event_ids":["ev_opp_c_op_is_01"],"opportunity_status":"sufficient","score":1,"selected_evidence_message_ids":["m005"]},{"comment":"三案の差や制約を検討せず、リスク後も根拠を更新しなかった。","confidence":0.86,"dimension":"logical_reasoning","flags":[],"not_evaluable_reason":null,"opportunity_evidence_event_ids":["ev_opp_c_op_lo_01","ev_opp_c_op_lo_02"],"opportunity_status":"sufficient","score":1,"selected_evidence_message_ids":["m020","m028"]},{"comment":"懸念には返答したが、内容を十分に受け止めた修正には至らなかった。","confidence":0.86,"dimension":"listening_and_response","flags":[],"not_evaluable_reason":null,"opportunity_evidence_event_ids":["ev_opp_c_op_li_01","ev_opp_c_op_li_02"],"opportunity_status":"sufficient","score":2,"selected_evidence_message_ids":["m008","m028"]},{"comment":"既存案を言い換えるだけで、制約を解く新しい提案を作らなかった。","confidence":0.86,"dimension":"valuable_contribution","flags":[],"not_evaluable_reason":null,"opportunity_evidence_event_ids":["ev_opp_c_op_va_01","ev_opp_c_op_va_02"],"opportunity_status":"sufficient","score":1,"selected_evidence_message_ids":["m010","m022"]},{"comment":"他参加者の立場を確認せず、合意を急いだ。","confidence":0.86,"dimension":"collaboration_and_relationship","flags":[],"not_evaluable_reason":null,"opportunity_evidence_event_ids":["ev_opp_c_op_co_01","ev_opp_c_op_co_02"],"opportunity_status":"sufficient","score":1,"selected_evidence_message_ids":["m012","m037"]},{"comment":"実施条件、例外、確認事項を詰めずに結論を固定した。","confidence":0.86,"dimension":"decision_and_consensus","flags":[],"not_evaluable_reason":null,"opportunity_evidence_event_ids":["ev_opp_c_op_de_01","ev_opp_c_op_de_02","ev_opp_c_op_de_03"],"opportunity_status":"sufficient","score":1,"selected_evidence_message_ids":["m020","m028","m037"]},{"comment":"時間通知後に優先順位を更新せず、終盤は検討を打ち切った。","confidence":0.86,"dimension":"process_and_time_management","flags":[],"not_evaluable_reason":null,"opportunity_evidence_event_ids":["ev_opp_c_op_pr_01","ev_opp_c_op_pr_02","ev_opp_c_op_pr_03"],"opportunity_status":"sufficient","score":1,"selected_evidence_message_ids":["m018","m032","m039"]}],"episode_id":"exercise-c-low-001","evaluation_stage":"independent","overall_notes":"Exercise C lowを証拠先行で独立採点した。","rubric_version":"candidate-behavior-v0.1","scenario_id":"candidate-assessment-c-time-boxed-decision","sheet_id":"rater-a-exercise-c-low-001","started_at":"2026-08-05T12:20:00Z","workflow_attestations":{"ai_scores_hidden":true,"evidence_selected_before_score":true,"identity_blinded":true,"rubric_consulted":true}}
