{"contract_version":"0.1","episode_id":"session_example_001","scenario_id":"market-entry-001","rubric_version":"candidate-behavior-v0.1","calibration_set_version":"calibration-spec-v0.1","evaluation_stage":"independent","workflow_attestations":{"ai_scores_hidden":true,"evidence_selected_before_score":true,"rubric_consulted":true,"identity_blinded":true},"overall_notes":"短い契約fixtureのため、観察機会がない軸はNEとした。","sheet_id":"rater_sheet_example_b_001","annotator_id":"rater_anon_b","started_at":"2026-08-04T06:10:00Z","completed_at":"2026-08-04T06:18:00Z","dimensions":[{"dimension":"issue_framing","opportunity_status":"sufficient","opportunity_evidence_event_ids":["event_001"],"selected_evidence_message_ids":["message_001"],"score":2,"confidence":0.68,"comment":"比較基準は提示したが、対象や制約の整理までは確認できない。","not_evaluable_reason":null,"flags":["EVIDENCE_AMBIGUITY"]},{"dimension":"logical_reasoning","opportunity_status":"sufficient","opportunity_evidence_event_ids":["event_001"],"selected_evidence_message_ids":["message_001"],"score":2,"confidence":0.81,"comment":"主張はあるが理由・根拠の接続は限定的である。","not_evaluable_reason":null,"flags":[]},{"dimension":"listening_and_response","opportunity_status":"insufficient","opportunity_evidence_event_ids":[],"selected_evidence_message_ids":[],"score":"NE","confidence":0.93,"comment":"シナリオ進行前にEpisodeが終了し、評価機会がない。","not_evaluable_reason":"INSUFFICIENT_OPPORTUNITY","flags":[]},{"dimension":"valuable_contribution","opportunity_status":"sufficient","opportunity_evidence_event_ids":["event_001"],"selected_evidence_message_ids":["message_001"],"score":3,"confidence":0.64,"comment":"三つの比較軸により後続議論の方向を具体化した。","not_evaluable_reason":null,"flags":["RUBRIC_AMBIGUITY"]},{"dimension":"collaboration_and_relationship","opportunity_status":"insufficient","opportunity_evidence_event_ids":[],"selected_evidence_message_ids":[],"score":"NE","confidence":0.93,"comment":"シナリオ進行前にEpisodeが終了し、評価機会がない。","not_evaluable_reason":"INSUFFICIENT_OPPORTUNITY","flags":[]},{"dimension":"decision_and_consensus","opportunity_status":"insufficient","opportunity_evidence_event_ids":[],"selected_evidence_message_ids":[],"score":"NE","confidence":0.93,"comment":"シナリオ進行前にEpisodeが終了し、評価機会がない。","not_evaluable_reason":"INSUFFICIENT_OPPORTUNITY","flags":[]},{"dimension":"process_and_time_management","opportunity_status":"insufficient","opportunity_evidence_event_ids":[],"selected_evidence_message_ids":[],"score":"NE","confidence":0.93,"comment":"シナリオ進行前にEpisodeが終了し、評価機会がない。","not_evaluable_reason":"INSUFFICIENT_OPPORTUNITY","flags":[]}]}
