{"annotator_id":"rater_a_anon","calibration_set_version":"exercise-c-high-low-v0.1","completed_at":"2026-08-05T12:35:00Z","contract_version":"0.1","dimensions":[{"comment":"初期段階で優先条件と比較軸を明示し、未確定条件も管理対象にした。","confidence":0.88,"dimension":"issue_framing","flags":[],"not_evaluable_reason":null,"opportunity_evidence_event_ids":["ev_opp_c_op_is_01"],"opportunity_status":"sufficient","score":3,"selected_evidence_message_ids":["m005"]},{"comment":"三案の弱点、遅延リスク、修正条件、実施条件を複数局面で接続した。","confidence":0.88,"dimension":"logical_reasoning","flags":[],"not_evaluable_reason":null,"opportunity_evidence_event_ids":["ev_opp_c_op_lo_01","ev_opp_c_op_lo_02","ev_opp_c_op_de_03"],"opportunity_status":"sufficient","score":4,"selected_evidence_message_ids":["m020","m028","m037"]},{"comment":"セキュリティと地域採用者の懸念を言い換え、具体的な案変更へ反映した。","confidence":0.88,"dimension":"listening_and_response","flags":[],"not_evaluable_reason":null,"opportunity_evidence_event_ids":["ev_opp_c_op_li_01","ev_opp_c_op_li_02"],"opportunity_status":"sufficient","score":4,"selected_evidence_message_ids":["m008","m028"]},{"comment":"遠隔導入、指定会場端末、後日補講を組み合わせた新しい実施構造を作った。","confidence":0.88,"dimension":"valuable_contribution","flags":[],"not_evaluable_reason":null,"opportunity_evidence_event_ids":["ev_opp_c_op_va_01","ev_opp_c_op_va_02"],"opportunity_status":"sufficient","score":4,"selected_evidence_message_ids":["m010","m022"]},{"comment":"異なる立場を例外設計と確認条件へ統合し、合意可能な形へ整えた。","confidence":0.88,"dimension":"collaboration_and_relationship","flags":[],"not_evaluable_reason":null,"opportunity_evidence_event_ids":["ev_opp_c_op_co_01","ev_opp_c_op_co_02"],"opportunity_status":"sufficient","score":4,"selected_evidence_message_ids":["m012","m037"]},{"comment":"比較、修正、例外、責任者、再判断条件まで含む実行可能な合意を形成した。","confidence":0.88,"dimension":"decision_and_consensus","flags":[],"not_evaluable_reason":null,"opportunity_evidence_event_ids":["ev_opp_c_op_de_01","ev_opp_c_op_de_02","ev_opp_c_op_de_03"],"opportunity_status":"sufficient","score":4,"selected_evidence_message_ids":["m020","m028","m037"]},{"comment":"40%と75%の通知後に論点を絞り、結論と確認事項を時間内に分離した。","confidence":0.88,"dimension":"process_and_time_management","flags":[],"not_evaluable_reason":null,"opportunity_evidence_event_ids":["ev_opp_c_op_pr_01","ev_opp_c_op_pr_02","ev_opp_c_op_pr_03"],"opportunity_status":"sufficient","score":4,"selected_evidence_message_ids":["m018","m032","m039"]}],"episode_id":"exercise-c-high-001","evaluation_stage":"independent","overall_notes":"Exercise C highを証拠先行で独立採点した。","rubric_version":"candidate-behavior-v0.1","scenario_id":"candidate-assessment-c-time-boxed-decision","sheet_id":"rater-a-exercise-c-high-001","started_at":"2026-08-05T12:20:00Z","workflow_attestations":{"ai_scores_hidden":true,"evidence_selected_before_score":true,"identity_blinded":true,"rubric_consulted":true}}
