{"contract_version":"0.1","episode_id":"session_example_001","scenario_id":"market-entry-001","rubric_version":"candidate-behavior-v0.1","calibration_set_version":"calibration-spec-v0.1","evaluation_stage":"independent","workflow_attestations":{"ai_scores_hidden":true,"evidence_selected_before_score":true,"rubric_consulted":true,"identity_blinded":true},"overall_notes":"短い契約fixtureのため、観察機会がない軸はNEとした。","sheet_id":"rater_sheet_example_a_001","annotator_id":"rater_anon_a","started_at":"2026-08-04T06:00:00Z","completed_at":"2026-08-04T06:08:00Z","dimensions":[{"dimension":"issue_framing","opportunity_status":"sufficient","opportunity_evidence_event_ids":["event_001"],"selected_evidence_message_ids":["message_001"],"score":3,"confidence":0.86,"comment":"目的に対する比較基準を三つ提示し、議論可能な形にした。","not_evaluable_reason":null,"flags":[]},{"dimension":"logical_reasoning","opportunity_status":"sufficient","opportunity_evidence_event_ids":["event_001"],"selected_evidence_message_ids":["message_001"],"score":2,"confidence":0.72,"comment":"比較軸は示したが、各軸を採用する理由や根拠は明示していない。","not_evaluable_reason":null,"flags":[]},{"dimension":"listening_and_response","opportunity_status":"insufficient","opportunity_evidence_event_ids":[],"selected_evidence_message_ids":[],"score":"NE","confidence":0.95,"comment":"この短いEpisodeでは対象行動を示す機会がない。","not_evaluable_reason":"INSUFFICIENT_OPPORTUNITY","flags":[]},{"dimension":"valuable_contribution","opportunity_status":"sufficient","opportunity_evidence_event_ids":["event_001"],"selected_evidence_message_ids":["message_001"],"score":2,"confidence":0.7,"comment":"比較枠組みを追加した点は有効だが、具体案の改善まではない。","not_evaluable_reason":null,"flags":[]},{"dimension":"collaboration_and_relationship","opportunity_status":"insufficient","opportunity_evidence_event_ids":[],"selected_evidence_message_ids":[],"score":"NE","confidence":0.95,"comment":"この短いEpisodeでは対象行動を示す機会がない。","not_evaluable_reason":"INSUFFICIENT_OPPORTUNITY","flags":[]},{"dimension":"decision_and_consensus","opportunity_status":"insufficient","opportunity_evidence_event_ids":[],"selected_evidence_message_ids":[],"score":"NE","confidence":0.95,"comment":"この短いEpisodeでは対象行動を示す機会がない。","not_evaluable_reason":"INSUFFICIENT_OPPORTUNITY","flags":[]},{"dimension":"process_and_time_management","opportunity_status":"insufficient","opportunity_evidence_event_ids":[],"selected_evidence_message_ids":[],"score":"NE","confidence":0.95,"comment":"この短いEpisodeでは対象行動を示す機会がない。","not_evaluable_reason":"INSUFFICIENT_OPPORTUNITY","flags":[]}]}
