{"contract_version":"0.1","sheet_id":"rater-a-exercise-a-high-001","episode_id":"exercise-a-high-001","scenario_id":"candidate-assessment-a-ambiguous-structure","annotator_id":"rater_high_a_anon","rubric_version":"candidate-behavior-v0.1","calibration_set_version":"exercise-a-high-v0.1","started_at":"2026-08-05T02:10:00Z","completed_at":"2026-08-05T02:25:00Z","evaluation_stage":"independent","workflow_attestations":{"ai_scores_hidden":true,"evidence_selected_before_score":true,"rubric_consulted":true,"identity_blinded":true},"dimensions":[{"dimension":"issue_framing","opportunity_status":"sufficient","opportunity_evidence_event_ids":["ev_opp_01","ev_opp_02","ev_opp_03","ev_opp_04"],"selected_evidence_message_ids":["m004","m014"],"score":4,"confidence":0.92,"comment":"目的、対象、制約、成功基準を構造化し、優先順位まで示した。","not_evaluable_reason":null,"flags":[]},{"dimension":"logical_reasoning","opportunity_status":"sufficient","opportunity_evidence_event_ids":["ev_opp_04","ev_opp_05","ev_opp_11"],"selected_evidence_message_ids":["m014","m017","m020"],"score":4,"confidence":0.92,"comment":"二案の利点・リスク・撤退条件を比較し、不確実性を扱った。","not_evaluable_reason":null,"flags":[]},{"dimension":"listening_and_response","opportunity_status":"sufficient","opportunity_evidence_event_ids":["ev_opp_06","ev_opp_07"],"selected_evidence_message_ids":["m011","m016"],"score":4,"confidence":0.92,"comment":"騒音と動線の懸念を言い換え、具体条件へ統合した。","not_evaluable_reason":null,"flags":[]},{"dimension":"valuable_contribution","opportunity_status":"sufficient","opportunity_evidence_event_ids":["ev_opp_08","ev_opp_09","ev_opp_11"],"selected_evidence_message_ids":["m009","m016","m017"],"score":4,"confidence":0.92,"comment":"複数案を改善・統合し、運用表と撤退案まで補った。","not_evaluable_reason":null,"flags":[]},{"dimension":"collaboration_and_relationship","opportunity_status":"sufficient","opportunity_evidence_event_ids":["ev_opp_10","ev_opp_07","ev_opp_11"],"selected_evidence_message_ids":["m011","m016","m020"],"score":4,"confidence":0.92,"comment":"三つの立場へ未解決点を問い、少数懸念を合意条件に組み込んだ。","not_evaluable_reason":null,"flags":[]},{"dimension":"decision_and_consensus","opportunity_status":"sufficient","opportunity_evidence_event_ids":["ev_opp_11","ev_opp_04"],"selected_evidence_message_ids":["m014","m017","m020"],"score":4,"confidence":0.92,"comment":"指標、閾値、中間レビュー、撤退条件を含む合意を作った。","not_evaluable_reason":null,"flags":[]},{"dimension":"process_and_time_management","opportunity_status":"sufficient","opportunity_evidence_event_ids":["ev_opp_12","ev_opp_08"],"selected_evidence_message_ids":["m009","m021"],"score":3,"confidence":0.92,"comment":"残り時間、次の論点、担当、中間レビューを具体化した。","not_evaluable_reason":null,"flags":[]}],"overall_notes":"high校正ケースとして独立採点した。"}
