{"contract_version":"0.1","sheet_id":"rater-b-exercise-a-low-001","episode_id":"exercise-a-low-001","scenario_id":"candidate-assessment-a-ambiguous-structure","annotator_id":"rater_low_b_anon","rubric_version":"candidate-behavior-v0.1","calibration_set_version":"exercise-a-low-v0.1","started_at":"2026-08-05T03:30:00Z","completed_at":"2026-08-05T03:45:00Z","evaluation_stage":"independent","workflow_attestations":{"ai_scores_hidden":true,"evidence_selected_before_score":true,"rubric_consulted":true,"identity_blinded":true},"dimensions":[{"dimension":"issue_framing","opportunity_status":"sufficient","opportunity_evidence_event_ids":["ev_opp_01","ev_opp_02","ev_opp_03"],"selected_evidence_message_ids":["m004","m006"],"score":1,"confidence":0.88,"comment":"対象、制約、判断基準を整理せず、曖昧なまま案へ進んだ。","not_evaluable_reason":null,"flags":[]},{"dimension":"logical_reasoning","opportunity_status":"sufficient","opportunity_evidence_event_ids":["ev_opp_04","ev_opp_05","ev_opp_11"],"selected_evidence_message_ids":["m014","m017","m020"],"score":1,"confidence":0.88,"comment":"選択理由や根拠を示さず、比較を行わなかった。","not_evaluable_reason":null,"flags":[]},{"dimension":"listening_and_response","opportunity_status":"sufficient","opportunity_evidence_event_ids":["ev_opp_06","ev_opp_07"],"selected_evidence_message_ids":["m011","m016"],"score":2,"confidence":0.88,"comment":"懸念へ反応したが、内容を踏まえた修正や確認はなかった。","not_evaluable_reason":null,"flags":[]},{"dimension":"valuable_contribution","opportunity_status":"sufficient","opportunity_evidence_event_ids":["ev_opp_08","ev_opp_09","ev_opp_11"],"selected_evidence_message_ids":["m009","m016","m017"],"score":1,"confidence":0.88,"comment":"既出の交流案を繰り返し、具体化や改善を行わなかった。","not_evaluable_reason":null,"flags":[]},{"dimension":"collaboration_and_relationship","opportunity_status":"sufficient","opportunity_evidence_event_ids":["ev_opp_10","ev_opp_07","ev_opp_11"],"selected_evidence_message_ids":["m011","m016","m020"],"score":2,"confidence":0.88,"comment":"礼儀は保ったが、他者の参加促進や対立調整は行わなかった。","not_evaluable_reason":null,"flags":[]},{"dimension":"decision_and_consensus","opportunity_status":"sufficient","opportunity_evidence_event_ids":["ev_opp_11"],"selected_evidence_message_ids":["m017","m020"],"score":1,"confidence":0.88,"comment":"判断基準なしに結論を急ぎ、反対意見や実行条件を扱わなかった。","not_evaluable_reason":null,"flags":[]},{"dimension":"process_and_time_management","opportunity_status":"sufficient","opportunity_evidence_event_ids":["ev_opp_12","ev_opp_08","ev_opp_11"],"selected_evidence_message_ids":["m009","m021","m020"],"score":1,"confidence":0.88,"comment":"時間や進捗を管理せず、結論と次の行動を整理しなかった。","not_evaluable_reason":null,"flags":[]}],"overall_notes":"low校正ケースとして独立採点した。"}
